personal de  salud con mayor vocacion al servico medico y honestos,.,.,.
mas enfoque hacia la prevencion desde las  ecuelas ,.,.,.
medicina preventiva atrabes de la educacion nutricional,.,.,.
que en la 4t sea humanista con el comercio informal y astesanos que no perciben seguridad social.  ,.,.,.
optimizacion de los medicamentos  establecidos e integrar un mayor suministro de los mismos,.,.,
reformar la ley general de salud para prohibir narcóticos y psicóticos que la marihuana solo sea de uso científico y medicinal basándose en los estudios de la neurociencia,Que todos tengan el beneficio de becas en universidades técnicas como la universidad tecnológica de Zinacantepec que solo algunos tienen beca,el apoyo desde la educación inicial el respeto a las mujeres,promover la diversidad hasta una edad adecuada no desde la niñez sino pasada a la adolescencia
para obtener mejor alimentación tenemos que tener todos los productos más accesibles por tanto está muy caro y no nos alcanza para todo porque en la actualidad si compro comida no compro frutas y verduras,implementar talleres en las escuelas apoyar a las escuelas en sus necesidades,que se le dé el apoyo a las mujeres que lo necesitan ya que es al revés,referirnos a la familia es convivir más con los hijos y comentar con ellos estos temas que antes eran intocables
las mujeres trabajamos más en casa,que ya no cobren inscripciones en las escuelas no hay gran maltratos peleas porque es lo más que se ve falta de respeto con los maestros les faltan el respeto a los alumnos y hay y que haya seguridad en las escuelas,que se atienda a todas las mujeres se tomen en cuenta a todas,control del contenido de redes sociales en menores de edad para evitar actos violentos adicciones a la pornografía también en adultos
,que los docentes sean muy preparados y cambien reglas de su sindicato para que no cualquiera sea trabajador de la SEP,tipificar el acto de personas o de los familiares que les roban sus apoyos a las y los adultos mayores,que hagan leyes para respetar todas las diversidades
que haya más posibilidades centro de salud para atender a más gente,que se tomen en cuenta a los padres de familia para definir los contenidos de los libros de texto,impulsar un cambio en la cultura del machismo pero con todos los seres humanos,hay muchas personas que siguen discriminando a esas personas hasta si van a pedir trabajo por su forma de vestir y no se vale todos somos iguales y reforzar las lenguas indígenas
que la liconsa con productos de abarrotes a buen precio centros de salud con laboratorios para estudios y radiografías,que se hagan más escuelas y universidades para que no sé quede los jóvenes sin estudiar,que nos den más apoyo y nos pongan el seguro popular porque no todos tenemos mucho dinero para llevar a particulares la verdad sí lo necesitamos,paridad con comunidad lgbt atender la prevención y potencializar la distribución de medicamentos para tratamientos de personas con VIH fortalecer la consulta con respeto
capacitar al servicio encargado,no cubren las inscripciones ya que las cobran a alto precio así mismo que las pensiones sean en general no para los adultos mayores,pero que las mujeres también sean honestas las mujeres que hablen con la verdad,ajá apoyar a las personas ya que muy independiente desorientación sexual todos somos iguales no tenemos por qué discriminarlos todo esto antes era considerado como personas raras o enfermas eran como estereotipos
campañas y brigadas de salud en escuelas,regresar la autoridad a los profesores en las aulas ya que hoy en día no se respeta el alumno al profesor y él no le puede llamar la atención al alumno porque los padres se molestan,reconocer el trabajo de cada ama de casa,que haya fundaciones que ayuden a las personas que son echadas de casa por su sexualidad
que los médicos hagan su trabajo con ética,guiar o dirigir la educación hacia el pensamiento crítico,que se dé mayor fomento a la educación con perspectiva de género,
evitar en lo más posible hacer uso de la farmacéutica necesitamos mejorar la alimentación sin obesidad fuera coca-cola McDonald's y esas cadenas bebidas energéticas azúcares,que haya mayor porcentaje de becas para estudiantes para que puedan acabar sus estudios,seguir dando trabajo a la mujer,
que la atención sea cordial y las haya personas que realmente tengan amor a su trabajo para que la atención sea con respeto y no con prepotencia,que los programas lleguen a los comunidades y a todos los niños se les de beca y a todas las escuelas,más que nada un cambio en salario y condiciones de trabajo tanto para hombres y mujeres 6 horas de trabajo y mejor sueldo,
la salud comprende tres rubros mental física y social me gustaría que también se incluyeran propuestas para atender al bienestar mental y social,un país que no invierte en educación tardan temprano invierte en armas,que sea parejo para hombres y mujeres que no haya desigualdad,
prácticas de orientación,,aumentar la seguridad,
,,que Los sueldos sean justos porque le pagan más a un hombre que a una mujer,
,,para que a las mujeres estén más seguras cuando salgan a la calle más cámaras luces y en los trabajos tienen que aceptar a las mujeres embarazadas en el machismo en cualquier trabajo,
,,al hablar de violencia familiar casi siempre la victimiza la mujer por qué he vivido violencia familiar y soy hombre creo que en el hablar de violencia tiene que ser más amplio,
,,las mujeres tengan más libertad de expresión,
,,aplicar la ley en todos sus ámbitos y darle legalidad a la seguridad salarial,
,,como hombres y mujeres tenemos el mismo derecho,
,,trabajar más en los derechos de las mujeres y dar prioridad más a la,
Que a los trabajadores del sector salud no abusen de su espacio laboral y tengan mejor trato,Que no se hereden ni se vendan plazas para poder cubrir las necesidades del pais y cubrir la totalidad territorial,Revalorar la funcion educativa de las mujeres hacia los hijos en el entorno familiar,Tener una buen capacitacion de mentalidad
Garantizar las dotaciones de medicamentos,Que los maestros se actualizen y que enseñen de base otros idiomas ,Me gustaria un lugar mejor de tranahjo para las mujeres y superar la economia,Incluir una secretaria en cada comite estatal de la comunidad y diversidad sexual
Recibir buen trato en atencion de salud ,Realizar un censo de infraestructura de las instituciones educativas,Poner atencion tambien en la violencia politica por razon de genero que ejerce el presidente,Comunicar la importancia de la familia 
,Educar a padres de familia por la cultura ,Se siga trabajando la igualdad de derechos,
,Tener maestros responsables en la educacion de los alumnos y dedicacion a las escuelas,Ellas respeten al hombre ,
,,,
debemos tener suficientes medicinas ,es necesario que todas las escuelas del país sean renovadas ya que los gobienros pasados las abandonaron ,integración de las mujeres a la economía siempre y cuando la carga laboral sea equitativa y se agregen al trabajo de riesgo ,"que ninguna persona tiene derecho a discriminar a nadie ante , y poder aprneder más de las personas con otra orientación sexual "
lo que se necesita es suirtir de medicamentos ya que las clinicas están vacías ,que haya más becas para que todos los jóvenes puedan seguir estudiando ,,
que los centro de salud sean de 24 horas y con personal amable  porque dan muy mal servicio ,que no cobren en las escuelas ,,
Que existan lugares para hacer ejercicio públicamente,Que se integre en actividades extraordinarias en las escuelas para que a los padres no les cueste dinero después integrar a los hijos actividades,,
Que todos los hospitales estén equipados,,,
supervizar los centros de salud y hosítales del IMSS para que vean ala atención que nos dan ,espero que haya mejores maestros y actualizados ,igual dad y respeto en todas las áreas laborales ,hacer conciencia para inlcuir libros de estos temas 
más atención en todos los servicios ,vigilar a los maestros para que sí den clases ,que los hombres tambíen trabajen en casa,promover el respeto a la diversidad de género  valorando y reconociendo  sus capacidades como seres humanos 
que haya especialidades en todos los hospitales ,apoyar con más becas ,que haya igualdad de género ,ser tomadas en cuenta cada una de las personas porque todos somos mexicanos 
que los hospitales no esten coludidos con clinicas privadas ,que se combata la cuestion sindical ,que se valore a las mujeres jubiladas ,"no se debe de discriminar a nadie , respetar a todos por igual"
necesitamos medicos en zonas rurales ,dar una mejore educación en casa para cuanod vayan a la escuela esten más preparados ,nos debemos apoyar entre mujeres ,que se respeten a todos 
que no haya preferecia en los hospitales ,,garantizar la ayuda en el hogar ,debemos quererlos y tratarlos como gente humana 
que se brinden los apoyos necesarios para el traslado de enfermos ,,que se respeten las decisiones de las muejeres ,considerarlos como miembros humanos  y respetarlos y tratarlos como merecen 
,,sean permanente en hacer valer todas la propuestas ,fomentar el humanismo mexicano 
"Brindarles espacios y reconocimientos a los licenciados en Salud Pública, que son el personal de salud altamente capacitados para compartir temas que ayden a la población a fomentar estilos de vida saludables. Por tanto, se necesita activar el código de Salud Pública y destinarle el recurso necesario",Que se mejoren y amplíen las oportunidades educativas gratuitas a posgrado o educación superior,Sancionar cualquier conducta discriminativa con razón de género,Se deben generar más oportunidades para este sector de la diversidad
Que haya jornadas de salud para llevar un camión de SSA a las comunidades marginadas,Seguir impulsando a la Nueva Escuela Mexicana,"Incluir desde prescolar materias destinadas a la equidad de género, erradicación de violencia, discriminación","Más que impulsar leyes, se deben tener leyes que obliguen a la ciudadanía a entender y cumplir con lo establecido para la defensa de la diversidad, protegiendo con ello los derechos individuales de las niñas, niños y ciudadanía en general"
Derecho a la salud para todos,Un Acuerdo Nacional al centro las y los niños jóvenes donde se logre recomponer el tejido administrativo  hacia los docentes y trabajadores de la educación,Mayor espacio en cargos públicos para mujeres,Darles espacios seguros laborales a este sector 
"Garantizar el acceso universal a la salud, con otorgamiento de un salario justo y prestaciones a todo el personal de salud sin distinción de afiliación sindical o partidista","Crear un proyecto donde los padres puedan concientizarse respecto a temas de género, inclusión y derechos humanos",Seguir generando condiciones de seguridad para las mujeres,Sensibilizar en el ámbito laboral sobre el tema de la diversidad sexual
"Se requiere más inversión en materia de la industria farmacéutica, para que puedan haber más productos de medicamentos en México",Acercar la educación de calidad a comunidades remotas con acceso a servicios educativos,Creación y fortalecimiento de instituciones que apoyen y atiendan a mujeres en áreas de salud mental y problemas de adicciones,Incluir y fomentar en los libros de texto temas relacionados a la diversidad sexual y a la no discriminación
Mejorar la calidad y atención por parte del personal que labora en hospitales y administración,"Promover un gran diagnóstico con los jóvenes de secundaria, para ver qué sucede",Implementación de talleres para varones con la finalidad de una verdadera concientización de igualdad para con las mujeres de México,"Concientizar sobre el tema del lenguaje inclusivo, aportando argumentos"
Prohibir los alimentos chatarra en escuelas,Fortalecer a las escuelas ubicadas en municipios poco seguros,Poder decidir sobre nuestros cuerpos ,Fomentar campañas de sensibilización a la ciudadanía sobre este tema
Que no falten medicamentos en la farmacia para surtir las recetas médicas ,"Revisar planes curriculares, valorando prioritariamente materias encaminadas a la facilitación de valores y principios de convivencia social",Igualdad salariar en términos de género,Legislar en estos temas en nuestro estado de Michoacán
Concientizar al personal de salud y al público en general acerca de la gordofobia,Mejores condiciones de espacio en todas las escuelas,"Compatibilidad entre labores domésticas, cuidados maternos y un empleo formal",Mayor presupuesto a políticas públicas y programas sociales sobre diversidad sexual
"Los profesionales de salud enviados a las localidades rurales deben ser altamente capacitados para poder atender correctamente a la ciudadanía, porque actualmente sí existen consultorios pero están abandonados o sólo hay médicos generales",Concebir la inclusión de personas con discapacidad como algo prioritario,Mayor inclusión de las mujeres y niñas indígenas,Políticas públicas para la protección de los derechos de la comunidad LGBT
Fortalecer la soberanía alimentaria,Un aumento para las y los maestros,Equidad salarial y prestaciones iguales,La continuidad de leyes donde haya reparación de justicia a la comunidad LGBT
Garantizar a la población el acceso a la salud pública enfocada en el tema de la salud mental,Mejorar la educación a distancia,"Dar seguimiento exhaustivo a las demandas sobre violencia de género, pues a muchas de ellas solo se les da carpetazo","Revisar el compendio legislativo y normativo para la inclusión, la igualdad, el respeto, la equidad, etc."
Que los funcionarios de alto nivel sean atendidos en el seguro social ,Mejores salarios a todo el personal educativo,,"Limitar el contenido mediático y de lenguaje de odio en los medios de comunicación, instituciones eclesiásticas y educativas"
"Es importante analizar los salarios del personal de enfermería para que sea reconocido el nivel de licenciatura, ya que este es el grupo donde recae mayor responsabilidad  en el sentido de atención directa y las 24 horas del día",Aumentar y mejorar las condiciones laborales de los maestros en comunidades,,"Creación del Instituto de la Comunidad LGBTTTIQ+ , en la cual se pueda implementar un centro de atención de la salud mental"
Aumentar el presupuesto para todo el sector salud,Aumentar telebachilleratos estatales,,
"Supervisar y auditar al sector de salud pública y a sus funcionarios, pues también hay corrupción ahí",Eliminar prácticas de maestros con múltiples grados en las rancherías,,
Resolver de manera urgente la distribución de medicamentos cobtrolados ,Generar modelos pedagógicos sin distinciones epistémicas y siempre con miras a generar conciencia crítica,,
Centrar los esfuerzos en la prevención y no en la atención,Incluir más temas de educación enfocados en la salud y con ello prevenir enfermedades,,
Que haya hospitales y clínicas mejor equipados,Impulsar a docentes calificados para brindar las materias o bien capacitarlos de manera correcta y hacerlos llegar a comunidades vulnerables,,
,Tomar mucho en cuenta a las niñas y mujeres indígenas,,
,Las mismas escuelas deben poner un porcentaje para mantenimiento y becas,,
,Que nadie se quede sin educación ,,
,"Promover una educación que les enseñen a afrontar la vida de forma crítica, analítica y libre ",,
,Educación transversal,,
,Crear y mejorar a las universidades que se encuentran en zonas alejadas,,
Combatir la corrupción en los hospitales,Fortalecer las escuelas públicas de educación básica,Programas de vigilancia para evitar violencia a las mujeres,
Proyectos para que haya laboratorios del Estado que puedan elaborar los medicamentos,Programas para evitar la obesidad desde las escuelas de educación básica,,
Programas para equipar los hospitales,,,
Contralorías ciudadanas que puedan vigilar los gastos en los hospitales públicos,,,
Universalizar el acceso a la salud,,,
Más clínicas de primer nivel en las zonas rurales,,,
Programas de cuidado de primer nivel para que las enfermedades graves no avancen,,,
"Implementar el medicamento en las clinicas IMSS, ISSSTE y SSA, ademas de medios especialistas que son insuficientes a nivel EDO.",Los maestros les dan una capacitacion bien para que esten preparados ,Debemos incluir a las mujeres,Que el amor se implemente con todas y todos respetando la equidad de los ciudadanos para el bien comun de la nacion
Que no haya desabasto de los medicamentos si no que tengan los medcamentos que necesitamos las personas,Seguir mejorando la capacitacion de los maestros para brindar una mejor educacion complementaria,"Construir leyes publicas para la igualdad de genero, pero tambien igualdad de responsabilidades",Contraten medicos para las personas que tienen sidam tengan medicamentos y asesoria de los medicos
Necesitamos medicamentos en las unidades medicas no promesas de salud,Tener un buen seguimiento en las becas bienestar pues este año ya no le llegaron a muchos niños de primaria ,Reabrir las gyarderias para que las mujeres tengan tiempo de trabajar y escuelas de tiempo completo,Cuidando mucho el respeto y tambien las personas de diferente genero respetar las familias tradicionales
No se queden afuera de la escuela aspirantes a medicina,Que cumplan con las becas que prometen por que las estan quitando ,Igualdad de sueldos,"Ofrecer talleres impartidos por expertos dirigidos a la comunidad LGBTIQ, donde se motive a dicha comunidad a que su libertad y preferencias deben garantizar no ser un peligro para la sociedad y deben ir de la mano con una constatnte evolucion en su calidad como seres humanos "
Supervisar que los medicamentos lleguen al pueblo por que siempren dicen que no hay,Ser obligatorio el novel medio superior como prepa y aplicar la ley para los tutores que no cumplan con la obligacion ,La preparacion que constituya la unidad familiar,Que sea penado cualquier agresion a personas LGBTIQ
Que no falte medicamento en los centros de salud y hospitales,Que se designen mas maestros a las escuelas por que en mi comunidad todo el ciclo escolar pasado no hubo maestros ,Que hay trabajo de igualdad para hombres y nujeres,
"Contratacion de medicos especialistas , garantizar mejor abasto de medicamentos",,Que los institutos para la mujer cuenten con lo necesario para su funcionamiento,
Servicio medico al alcance de toda la ciudadania y abastecimiento de todo tipo de medicamentos,,Aumento de oportunidades para el trabajo en el trabajo para las mujeres ya que estamos igual en la capacitacion y el esttudio,
"Mas acceso a los servicios del sector de salud pues hay menos acceso a el, habemos poblacion de escasos recursos",,"Dar oportunidad de trabajo inmediato y atencion cuando son agredidas , con albergues de atencion ",
,,Mejor trato en el trabajo,
,,Que existan campañas para campo laboral femenino y no haya restricciones,
,,Campañas de concientizacion para el respeto a las mujeres y su revalorizacion en la vida diaria y laboral con la finalidad de que haya menor discriminacion ,
,,Propuestas de empleo comunitario supervizado por mujeres y crear guarderias para que las mujeres con hijos sean incluidas y generen un ingreso extra en el hogar,
,,Paguen justamente por el trabajo y no por el sexo,
,,Que las mujeres tengan informacion para no admitir a personas machistas y que sepam que tengan derechos,
,,Pension universal para todas las madres solteras,
,,Informacion mas intensa sobre los derecjos de las mujeres,
"Que todas las personas sean atendidas igual. No tomar o escoger amistades, personas con más dinero, ni gentes influyentes, sino atender igual al pobre al rico, vista como vista.","Ojo, que los maestros sean más responsables y que cumplan con sus labores como lo que son.",Que el apoyo de 65 y más sea 50 y más para alcanzar algo del gobierno.,"Con respeto de unos a otros, si piden respeto también que ellos respeten y que se les prohíba adoptar niños o niñas porque los menores aun no tienen criterio y pueden engañarlos mentirles fácilmente. El respeto debe ser en todo lugar principalmente en escuelas."
No sobre ocupar las instituciones de salud que ya existen porque no hay infraestructura para tantas personas.,Apoyar a los estudiantes.,"También es necesario dar el seguro a trabajadoras domésticas. Dar 40 y más, porque a veces ni a esa edad llegamos.","Nunca se ha tomado en cuenta la importancia de ser hombre o mujer. No creo que debamos darle más importancia a algo que siempre ha estado, pero ahora de moda. Si vivimos educados y centrados a nuestras metas, no nos escandalizaremos por cosas diferentes a las nuestras."
Producir alimentos en las localidades y hacer una labor en la educación.,Que trabajen los maestros como debe de ser.,No más discriminación a las mujeres mucho menos  a los niños.,Revisar primero el desempeño de profesores ya que al ser el primer contacto con alumnos en ocasiones son ellos los principales generadores.
"Que se paren en seco a todos los monopolios de los voraces políticos que hacen negocio con la salud púbica, ¡Cárcel para estos vividores!","Para que se lleve a cabo todo lo que se propone en la boleta primordialmente hay que revisar las plazas y propuestas de empleo, únicamente se les reparte a hijos de los que ya tienen plazas o familiares y ni preparados están.","La mujer no debe de sufrir, deber de ganar suficiente dinero.",Que no haya exámenes.
Cuidar como se riegan los productos del campo y con qué se hacen los pesticidas y cualquier otro líquido tóxico.,"Garantizar educación de calidad en los textos implementados. Generalizar las becas a los alumnos con un promedio mayor a 8.5, son los alumnos que se ve que si aspiran a un crecimiento educativo.",Si asumen las mujeres derechos y responsabilidades se les trate de la misma forma tomando como ejemplo la marcha feminista de la cual solo hace daño a las infraestructuras.,"Promover en las escuelas dinámicas, donde participen los padres e hijos y maestros con los temas de discriminación, fomentar la importancia que tiene una familia unida."
"Implementar medicina tradicional gratuita a todo ciudadano sin importar condición social, religiosa, sexual, establecer comedores ciudadanos para gentes que no tienen familia.","Crear círculos de educación donde se le informe al pueblo y explique los sistemas educativos. Que la educación no sólo se imparta en las escuelas, en el medio común del individuo.",El niño tiene derecho y necesidad de su madre (atención).,Analizar y enfatizar las reformas de equidad y diversidad ya que están solo han demostrado ser un arma para las personas LGBTIQ
Ilegible.,"También que los maestros se capaciten y trabajen con ganas, muchos no enseñan matemáticas, física, química, inglés y las ignoran y esos no desquitan ni la cuarta parte de lo que les pagan y son viciosos.","Apoyo a madres solteras y padres solteros, para educación o sostenimiento del hogar, liberación femenina y masculina de las mujeres.","No privilegios especiales a los LGBT+Q, tampoco discriminación."
Un real acceso gratuito o bajo costo.,"Sí, invertir en educación, un país educado, informado y preparado es un país libre.",Que existan programas de centros de asistencia a menores y adultos mayores.,Que existan lugares donde puedan orientar y dar información segura y buenos consejos.
La movilidad y accesibilidad al uso de medios de transporte médico como ambulancias al servicio del pueblo.,"También que les den becas a los de escuelas privadas, no por el hecho de estar en escuela privada quiere decir que no tiene necesidad, al contrario, también ocupan apoyo económico.","Se reconoce la justicia que se ha hecho durante todos estos años ya que se han incluido en los diferentes sectores en la sociedad, en la que ya estamos en igualdad de condiciones para desempeñar y ocupar cualquier puesto laboral y político.",Fortaleciendo y creando espacios de respeto porque el respeto no solo es de hombres y mujeres sino de la comunidad LGBTIQ+ (Ilegible)
"Regular el equilibrio ecológico evitando pesticidas, herbicidas, productos transgénicos, regular los productos embutidos. Que los servicios de transporte como cruz roja, rescate etc, sean gratuitos, eficientes y públicos.","Que nos den apoyo a los que estamos en escuelas privadas, ya que también tenemos necesidad y también ocupamos apoyo.",Que les hagan caso cuando vayan a denunciar.,"Que haya más respeto, a no ser de este tipo de mujeres."
Que todos sean atendidos con igualdad.,"Considero que la transformación dio inicio en el 2018, ahora por consecuencia también en  lo educativo debe darse este cambio educativo y cultural de nuestra nación. Los incisos A, C Y D ya están en práctica dando buenos  resultados.",Crear más dependencias que apoyen a las mujeres sin tantas trabas.,Libertad es una palabra que usa de forma imprudente. La libertad de un individuo tiene su límite en el derecho de los demás
Prevenir enfermedades. Educar cómo debemos alimentarnos. Que el deporte en las escuelas sea una hora diaria. Que no se venda comida chatarra. Que la unidad deportiva sea más accesible para todos.,Que sea seleccionado el personal y capacitado para ponerse a la vanguardia de la tecnología actual.,Simplemente honestidad eliminar la corrupción dentro de las instituciones.,Intensificar más la cultura de género comenzando por las radioemisoras y la TV del gobierno
