Crear mecanismos para pacientes que solo acudimos para resurtir medicamentos sin ocupar un turno de atención,Procurar la seguridad de los estudiantes y combatir los comportamientos delictivos,,
que los médicos de atención primaria sean psiquiatras para deslindar enfermedades psicosomáticas,Fomentar más la lectura entre los niños,,
Garantizar tratamientos y cirugías sin discriminar el diagnóstico de los pacientes,Mejorar las condiciones salariales de los maestros,,
Dar seguridad social y servicios de salud a los trabajadores de morena y a los trabajadores de las gasolineras, Apoyo a las personas que trabajan en todas las Bellas Artes,,
 Jornadas de sensibilización a la comunidad respecto a la forma en cómo nos alimentamos,Qué hay en clases de educación cívica en todos los niveles ,,
Que los trabajadores de las alcaldías tengan derecho a la seguridad social y a la salud,Contar con mayores medios de difusión educativos,,
Disminución en el tiempo de espera para una consulta o una cirugía,Participación activa de padres y madres de familia en las actividades educativas,,
Más ambulancias para los servicios de emergencia ,Impulso al programa la escuela es nuestra ,,
Construcción de hospitales infantiles de especialidades,Aumento del presupuesto para becas a los jóvenes ,,
para qué el presupuesto y los recursos sean manejados con transparencia y rendición de cuentas,Profundizar en la enseñanza de la historia de México en todos los niveles educativos ,,
Mejorar la atención de la salud mental y dar apoyo a la familia de enfermos mentales,Incluir en los contenidos educativos el pensamiento filosófico es científico así como incluir habilidades para el desarrollo de la tecnología y las finanzas,,
 Crear un instituto de la medicina indígena en México,Fomento de las artes en la enseñanza,,
Mayor atención a los programas preventivos de salud,,,
Prestar más atención al abasto de medicamentos. Que exista un mejor servicio de laboratorios y estudiso medicos gratuitos,Clases de computación y de inglés desde educación primaria ,Paz y tranquilidad para las mujeres,Garantizar la la educación para la diversidad 
Mayor abasto de medicamentos y construir más clinicas de salud,Seguridad para los niños en las escuelas,Becas para las mujeres ,Tener major calidad educativa respecto de la educación sexual en su amplio críterio
Apoyo en centros de salud con mediacamentos para recibir una atención integra,Mayor capacitación a los maestros,Crear puestos para que todas las mujeres tengan empleo,Eliminar la discriminación
Aumentar el número de los centros de salud para evitar la saturación en los pocos que hay y mejorar la atención. Eliminar las filas y las esperas largas en los servicios de salud.,Vincular la educación con los sectores productores y empresalariales para garantizar empleos,Igualdad total ,Mismos derechos para todas las diversidades 
"Que el porgrama del ""campo a la ciudad"" se vuelva ley a nivel nacional ",Que las escualas sean de tiempo completo,Erradicar la violencia contra las mujeres ,"Crear porgramas para las poblaciones de la diversidad sexual que ejercen la prostitución por necesidad., así quien han sido expulsados del núcleo familiar por su prefrencia sexual y que viven en condición de calle. "
Que los trababajdores de la sulud cumplan con su trbabajo y que no lucren con los medicamentos ,Que se aplien las becas para estudiantes,Trato digno en los los abitos sociales para las mujeres ,
"Que haya mejoras en el los precios de todos los alimentos, ya que no podemos comprar cosas saludables por los cosotos elevados ",Que se construyan más universidades en provincia ,Respeto e igualdad laboral para las mujeres ,
Ayudar con abastecimiento de medicamentos a los centros de salud,Escuelas para niños de lento apredizaje. Que haya meriandas en las escuelas y que haya becas puntualales,Crear apoyos para las mujeres independientes,
Atención médica sin distinción alguna ,Sabatinas en las escuelas. Defensa personal a niños y adolescentes ,Que haya mecanismos adecuados y eficientes de justicia para las mujeres ,
Brindar un servicio respetuoso y profesional en todo momento y a todo el público ,Difundir las ofertas educativas de tecnológicos ,Crear apoyos para madres solteras ,
Atención primordial y auniversal aunque no se tenga seguri social. Todos tenemos derecho a la salud ,Que se acerque centros educativos a sectores con dificil acceso,Que por ley se orotguen dos días de descanso para las mujeres que se encuntran en su periodo menstrual  ,
Que se tenga más material de laboratorio y abastecimiento de medicamentos a los centros de salud. Que el servicio sea más humano,Que los maestros pongan más atención a los niños y den seguimiento de su formación,Apoyos para las esposas viudas ,
Areas exclusivas en hospitales para la gente con discapacidad ,,,
Que exista un servicio de madicamentos naturales y herbolaria a nivel nacional.  Promover la sana alimentación ,,,
Que los médicos tengan una muy buena preparación. Revisar constantemente la calidad del servicio médico,,,
Que haya trato amable y de manera igualitaria en los servicios de salud,,,
"Más centros de salud, más personal médico",,,
Horarios de servicios puntuales y que se abarque a todos los que lo solicitan.  Sustituir el sistema de fichas para atención médica. Que se atienda a todos los que se presentan,,,
Seguro social gratuito a los infantes independientemente de si sus padres son derechohabientes ,,,
Que haya más centros culturales con talleres y otras actividades  para que los niños tengan espacimiento despues de la escuela,,,
Programas espaciales de atención a diabeticos ,,,
Bienestra en el hogar para los niños,,,
Mejor atención y abastecimiento de médicamento para los hipertensos ,,,
"Que se realicen los programas prometidos para diabeticos, hipertensos y con enfermedades renales  ",,,
Mayor campaña de salud e información ,Fortalecer el sistema educativo en todos sus niveles,Atender el desempleo ,Más respeto a la comunidad LGBT+
Que no se condicione la atención médica pública ,No discriminación en ls escuelas ,MKayores penas para agresores,Permitir mayores empleos a la comunidad gay 
Que los hospitales púublicos atiendan las emergencias sin restricciones,Entregar las becas al medio superior tiempo y forma ,Apoyo a las mujeres en las denuncias,Reglamento para que las empresas acepten apersonas gay y lesbianas
Atención al cáncer de mama,Mejores salarios para docentes,vigilancia a las abogadas de las mujeres,Concientizar a las infancias para que no tengan dudas de su orientación 
Instaurar hospitales del ISSSTE en Milpa alta,Mayor inversión tecnológica,Vigilancia a los mecanismos de atención de la violencia,Terminar con los roles de género desde las infancias
Se incrementes los laboratorios clínicos públicos y gratuitos,Aumentar presupuesto de educación media superior,Capacitación de género en los MP,Eliminar la violencia a las personas trans
"Que se capacite a médicos, enfermeros y personal de hospitales",Progrma de apoyo a profesores,Igualdad sustantiva,Cooncientizar a las personas del respeto
terminar con la discriminación en los hospitales,Plazas para nuevos profesores,Educación no sexista,Profundizar la educación el tema de las toleracia hacia los demás para que desaparezca la discriminación.
Educación alimentaria para erradicar la diabetes,Promover el repeto a los docentes,Educación no machista,Mayor información de la vida de las poblaciones LGBTIQ+ sin la estigmatización.
Hospitales accesibles y equipados con personal capacitado,Psicologos para atención y salud mental,Centros de salud aptos para las mujeres,"Creación de contenido educativo y de entretenimineto del día a día sin problematizar en sexo, enfermedades o eventos violentos."
Hospitales de especialidades,Crear un instituto de capacitación continua para profesores,Campañas sobre igualdad de género,Seguir apoyando a la diversidad sexual en avante al reconocimiento de sus derechos.
Presupuesto para medicamentos y equipo ,capacitación constante a profesores,Créditos para negocio y vivienda para las mujeres,Informar a las personas más sobre este tema para que no se siga viendo como un tema tabú.
Sencibilización del personal médico ,Que se aumente el dinero de las becas a niñas y adolescentes,Atención a las mujeres con problemas de adicciones,Tratar de ser más concretos pues es delicado el tema.
Que el servicio médico sea un derecho para todas las personas,enseñanza de la cultura y tradiciones,educación a las mujeres en las zonas rurales,"Enseñar en las escuelas y medios de comunicación el amor, la sexualidad y la diversidad para construir la cultura de la transformación."
Atención de emergencias en IMSS e ISSSTE ,que los políticos estudien y no sean analfabetas ,Más oportunidades laborales a las mujeres,
Prioridad a la salud de las personas del campo,Terminar con el analfabetismo ,Sistema Nacional de Cuidados ,
Que se vigile la atención en los hospitales ,Campañas de alfabetización ,Sistema de justicia para las mujeres,
Que el personal en hospitales de trato digno y respetuoso,Poner aulas digitales en las escuelas básicas,Apoyo a madres solteras,
Atención sin discriminación ,Impartir matemáticas y ética,Talleres de deefensa personal para todas las mujeres,
Que los centros de salud sean honestos,Capcitación de docentes y salarios ,Campañas de prevención de ITS,
Que en los centros de salud den los médicamentos gratuitos,Que se impulsen proyectos como el de la Universidad de los Pies Descalzos en países de Oriente Medio.,Eliminar la discriminación de las escuelas,
Construcción de hospital de especialidades en Milpa alta,"Que expliquen y promuevan qué es la ""Nueva Escuela Mexicana"". No puedo opinar o apoyar algo que no conozco.",Más apoyo a proyectos económicos de las mujeres,
Servicio de salud universal ,Tener una verdadera capacitación acerca de los nuevos planes y programas.,Menos horas de trabajo y mejor sueldo,
Que los médicamentos no sean costosos,"Que los materiales lleguen en tiempo y forma, y no al vapor como ocurrió al inicio de este ciclo y al final del anterior.",Democrtatización de los cuidados,
Terminar con los monopolis de las empresas de medicamentos,Transformación en guarderías y CENDIS. Tienen que garantizar los cuidados y educación para los cuidados y educación para los pequeños y pequeñas.,Sitema nacional de cuidados integral,
Mayor atención para las personas con enfermedades crónicas ,"Incluir en el Sistema Educativo las diversas formas de aprender: motriz, mental y emocional.",Educación doméstica ,
Atención a las personas con cáncer,Implementar más educación sustentable.,Educación con perspectiva de género en toda la educación obligatoria.,
Atención de las personas con diabetes,Enfocarse en implementar más educación a las personas de bajos recursos.,Atención a la violencia sexual en el transporte público.,
Llevar un regustro público con seguimiento para la formación de médicos/as y enfermeros/as especialistas en las enfermedades que más nos aquejan.,Implementar una educación que no discrimine a nadie.,Mayor escucha a las mujeres.,
Que se apoye a la investigación médica.,Abrir más plazas para profesores.,Fortalecer la atención y dar mayor sustento jurídico a mujeres en los centros de justicia.,
"Mejorar aparatos, médicos y especialistas en el IMSS y el ISSSTE",Mayor calidad en la educación.,Apoyos económicos a mujeres.,
Trato más humano en el IMSS e ISSSTE.,Seguir erradicando el analfabetismo.,Que se garantice y se agilice el acceso a métodos anticonceptivos.,
Que la UNAM y el IPN se incorporen al sistema de salud nacional.,Desarrollo tecnológico.,"Mejores condiciones laborales. Desde capacitación a recursos humanos para tratar con mujeres, hasta talleres de profesionalización.",
"Dar atención a la salud mental de la población desde los primeros años de vida con deportes, música, cultura y medicina.",Apoyos a profesores.,,
Más servicios de salud a las comunidades más alejadas.,Combatir las desigualdades desde la educación pública e indígena.,,
Que se agilice la atención a enfermos en IMSS e ISSSTE,Abrir más escuelas de educación media superior.,,
Que todos los hospitales públicos tengan suficientes medicinas.,La perspectiva humanista debe enseñarse en todos los niveles.,,
Información permanente en todos los medios de comunicación sobre alimentación saludable.,Impulsar desde la 4T la formación del magisterio. Que esta genere proyectos educativos de vanguardia.,,
Monitoreo de los medios comunitarios de salud.,Reformar la Ley Orgánica de la Universidad Nacional Autónoma de México para llevar la democracia a la Universidad.,,
Difundir más los avances en la materia.,Devolver recursos a las universidades públicas de los estados.,,
,"Impulzar la democracia desntro del salón de clases, especialmente en las universidades.",,
,Que la escuela busque establencer relaciones horizontales entre docentes y estudiantes.,,
,Hacer un grupo de profesionales que apoyen y canalicen a niños genio.,,
,Más universidades.,,
,Generar programas de educación a niños que sus padres no llevan a la escuela.,,
Que haya un buen servicio en las instalaciones médicas y haya medicinas para abastecer a la mayoría de enfermos. ,Que los chicos tengan más universidades y más oiportunidades para que realmente puedan aprovechar libres sus estudios y todas las oportunidades se brindan para ellos. ,Cambiar la forma de contratar a las mujeres para laborar.,Educación para la aceptación de la preferencia sexual.
"Todos debemos tener el mismo trato y por respeto, ya que muchas veces nos tardan hasta 3 horas aunque llevemos mucho dolor. ",Creo que tenemos que fomentar en la casa el respeto hacia los maestros que han perdido. ,"Crear una gran campaña para generar igualdad de género, debe comenzar en casa, igualdad de derechos y obligaciones para todos los miembors de la familia. ","Empezar desde el hogar y en la familia. Los medios de información, la radio y televisión influyen en esto con su información tóxica que difunden. "
Lo más importante es la medicina preventiva. ,Necesitamos un humanista para dirigir el país. ,Áreas y herramientas en igualdad de condiciones. ,"Aceptar a la diversidad sexual tal y como son, ya que ellos forman parte de la sociedad."
"Transformar la cultural laboral del personal de salud, en el sector público, para mejorar la atención al pueblo para alcanzar el bienestar social. ","Que la educación sea gratuita, laica y de calidad. ",Hombres y mujeres con equidad verdadera e igualdad. ,Cumplir con las propuestas no las echen a la basura. 
"La supervisión de la industria farmacéutica, ya que hay abuso de medicamentos falsos y son dañinos para la salud. ",Cumplir las propuestas. ,Dar fuentes de trabajo a las mujeres y hombres que tienen hijos con discapacidad. ,Respetar sin forzar la inclusión. 
"La falta de medicamentos en toda la república es un grave probelma, no sólo para la sociedad.",Acabar con los gobiernos corruptos que mal informan a la población y se roban el presupuesto designado a la educación. ,Ir a las causas que construyen la mente feminicida. Como historial clínico (psicoanálisis) de feminicidios en México. ,"No se debe de perder el respeto. Todos deben de ser respetados, desde la casa. "
En los centros de salud han negado la aplicación de métodos anticonceptivos (dispositivos) por cualquier pretexto ¿Dónde queda la responsabilidad de la reproducción sexual?,Educación fuera de los ideales neoliberales.,"Revisar las condiciones laborales de las mujeres que las han obligado a trabajar paradas 8 horas, como cajeras dependientes en tiendas y farmacias. ","Hacer valor los derechos, sensibilizar y hacer que los funcionarios públicos eviten discriminar. "
"*Programas para atender las adicciones. *Revisión de ""los anexos"" pues ahí pasan las cosas negativas. ","Hacer una evaluación en las escuelas particulares, para ver que los niños necesitan el apoyo económico. ",Aumentar el apoyo a madres solteras y penalizar la falta de apoyo alimenticio por parte del padre.,Que existan castigos contundentes para las personas que agreden de alguna manera sobre este tema. 
"*Capacitar personal administrativo en el trato a los pacientes. *Se que no hay suficiente personal médico por los anteriores gobiernos, tratar de que las consultas con especialistas no demoren tanto. ","Llevar alimento a las escuelas, seguir con el apoyo de desayunos escolares. ","Foros o talleres de integración para acabar la violencia entre mujeres de nuestra comunidad. ""La violencia hacia las mujeres también son causadas por otras mujeres"".",
Hcaer más accesible el servicio de las cirugias mayores. ,Impulsar más a los profesores. No dejar solo de exigir un promedio arriba de 8. ,El apoyo fundamental en todo el ambiente ya sea laboral y higar ya que ellas son la parte más importante para la sociedad. ,
Cambiar la plantilla y supervisar que los funcionarios den atención de calidad y sean más empáticos. ,Habrá que poner más atención y presupuesto a las actividades culturales sobre todo para los niños. ,Que se cumplan las propuestas. ,
Es importante prevenir. ,"Poner más atención en la comunidad de niños con necesidades especiales. Esto es, a través de una buena atención pedagógica y psicológica poder diagnosticar y apoyar a niños con estas necesidades especiales que aún no son atendidos. ",Apoyo económico a las mujeres encargadas del cuidado de sus enfermos. ,
Orientación alimenticia y da la implantación de sistema para realizar actividades físicas. ,Impulsar la cultura al extranjero y evitar fugas de cerebro. Cursos a padres de familia desde psicológicas hasta culturales para tener herramientas para educar a sus hijos. ,Las mujeres ya están contempladas en la economía y contamos con los mismos  derechos laborales desde hace mucho tiempo. ,
Integrar a todos aquellos enfermeros que participaron en la pandemia. ,*Vigilar más a las asociaciones de padres de familias por el cobro que hacen (cuota) ya que no lo explican en las escuelas. ,Más oportunidades de trabajo para las mujeres. ,
"Tanto en sector salud compo hospitales de 1°, 2° y 3° grado, abastecer de equipos nuevos para tener una mejor atención al igual abastecer de medicamentos para que los médicos puedan tener mejor eficiencia en caso de emergencias. ",Mantener y aumentar la asistencia en alimentos para la gente sin recursos alimenticios y darles educación académica. Aumentar la creación de PILARES. ,Poner más ayudas a madres solteras pero con hijos más grandes.,
En todos los hospitales existe una mafía de falta de medicamentos. Necesitamos apoyo y supervisión de ellos. ,,"Asesoría rápida para una mujer que sea violentada, por su seguridad pero que realmente sea acertiva. ",
"Educación, alimentación y saludable desde la niñez y evitar consumo de productos chatarra. ",,Seguir impulsando leyes para proteger a las mujeres y se cumplan sus derechos. ,
"Se debe de impulsar, implementar políticas en el sistema de salud de primer nivel, para evitar saturar la atención en instancias de 3 nivel. ",,,
"Se tardan tanto para atender en una consulta y peor es cuando necesitan una cita en especialidad, se tardan meses. ",,,
Entrar al tema de la eutanasia. ,,,
"Como sugerencia adicinal, apoyo de servicio médico a madres solteras, sin necesidad de estar laborando en una empresa. ",,,
Sancionar al personal prepotente y que no atiendan con eficiencia y respeto.,,,
"Garantizar que la compra de medicamentos sea al que venda calidad y buen precio, no licitaciones a empresas que venden a sobreprecio. ",,,
*Que haya todo tipo de doctores para atender. *Que haya la medicina necesaria e indispensable. ,Aumentar un poco más las becas básicas porque hay familias con más niños en las primarias y secundarias. ,Mejor salario para las empleadas domésticas.,"Todo empieza desde casa, enseñar a respetar a todas las personas."
"El Ciudadano/Pueblo exija el servicio médico, ya que se niega si no llevas CURP. Y que se extienda el periodo de consultas. ",Que haya escuelas donde estudien los muchachos que tienen que trabajar.,Atención para las mujeres que son víctimas de violencia intrafamiliar.,"Inculcar una cultura de aceptación y respeto. En educación, laboral y profesional."
"Muy necesario equipar y tener personal apto y necesario en atención médica. Podemos vivir sin pavimento o electricidad, pero no sin atención a la salud. ",Que les den becas a cada niño y niña. Además de uniformes.,Mejor atención para denuncias de abuso hacía las mujeres. ,Todas las personas deben de ser tratadas iguales. 
Contar con dos médicos al menos en una clínica y así ser atendidos todos sin esperar al día siguiente. ,Que los maestros de las escuelas se enfoquen más en las enseñanzas a los alumnos de primaria y secundaria. Más lectura y escritura porque andan muy mal. ,Pláticas sobre los derechos humanos y autoestima en mujeres sobre todo amas de casa y madres de familia. ,Respetar los géneros sexuales. 
Necesitamos una atención de más calidad y no al desabasto de medicamento. ,Ofrecer programas de apoyo a instituciones educativas. Garantizar los materiales e infraestructura adecuadas para las escuelas. ,Más vigilancia en calles y en especial en delitos contra la mujer.,"Que se implementen las políticas púbicas, desde la escuela etc. El respeto hacia la sexualidad e implementar el amor hacia el projimo. "
Equipar los hospitales que ya están para que podamos contar con todos los servicios que ocupamos sin tener que viajar mucho para atender. ,*Reconocimiento a la labor docente con salarios justos. *Considerar buenos promedios para otorgar becas.,Mejorar las condiciones laborales para las mujeres.,Respeto a las y los demás. Generar ambientes de conciencia desde el ámbito familiar y educativo. 
"Que se encuentre medicamento en todos los hospitales, consultorios del IMSS, ISSSTE para garantizar la salud de los mexicanos. ",Exigir maestros y docentes más preparados. Instalaciones saludables. ,"Establecer comités de apoyo y asesoría a la mujer, así mismo del cuidado a las mujeres. ",El respeto a todo tipo de parejas. 
Buena atención y sin tener que estar rogando un servicio que es escencial para todos y todas. ,Más control sobre las acciones educativas y el desempeño del personal.,,"Fomentar el respeto por la vida en sus diferentes naturalezas, como seres humanos. "
Abastecimiento de medicamentos. De nada sirve un hospital o clínica sin medicamentos. ,Ayudar con la educación en el campo. ,,Platicas y orientaciones para que cada persona realmente tenga claro sus gustos y sus preferencias sexuales y no lo hagan por influencia o por moda.
"Generar atención médica las 24 horas del día, sin limitar la atención. ",Mayor infraestructura en las escuelas. ,,Que todos los géneros deben de vivir tal como son y deben respetar a los demás. 
Tener una mejor atención. Ya que acudes al Centro de Salud y no hay servicios que requieres. ,Agregar en cada institución un psicólogo por obligación y todos los alumnos y padres tengan acceso a terapias. ,,
,,,
Que acabe la gente corrupta.,,,
Mejorar los servicios.,,,
Psgo digno a los médicos.,,,
"Derecho a los adultos mayores y todos y todas las personas que tegas alguna enfermedad crónico-degenerativa que son de mayor atención, sobre todo que nunca nos mandan con los especialistas.",,,
Atención con amabilidad del personal.,,,
Consultas gratis en los centros de salud.,,,
Talleres en las escuelas para fomentar los riesgos de salud que hay y como evitarlos.,,,
Apoyo a los adultos mayores con medicamentos.,,,
Que haya medicamento controlado con receta.,,,
Clínica de hemodiálisis.,,,
Apoyar a las escuelas con alimentos.,,,
Que haya medicamento controlado con receta en los hospitales.,,,
"Clínica de hemodiálisis, ya que hay mucha gente que tiene que trasladarse hasta el centro de Durango y es muy caro.",,,
Centro de salud en las regiones más apartadas (indígena).,,,
Apoyo a personas sordomudas.,,,
Apoyo a los médicos.,,,
Terminra con la basura para un entorno saludable.,,,
Estar al pendiente del IMSS y de su personal.,,,
Más seguridad en el entorno.,,,
Pensiones de discapacidad.,,,
Informar a la población cuando se va a implementar en el estado de Durango el programa IMSS Bienestar.,,,
Que no haya discriminación.,,,
Que los sietmas de salud que ya existen se les de el mantenimiento necesario y que se enfoque a dar el suficiente personal e infraestructura como el ISSSTE ya no es suficiente.,,,
Trato igualitario para todos.,,,
Más medicamentos para diabéticos.,,,
Incluir prótesis en cirugias de columna.,,,
Oportunidades para personas discapacitadas.,,,
Salud gratuita para las clases más necesitadas.,,,
Dar atención y brindar los medicamentos necesarios.,,,
"Priorizar el insumo de medicamentoa, ya que nunca hay el medicamento necesario.",,,
Que la canasta básica sea más barata para que haya mejor alimentación.,,,
"Verificar al personal de salud, que brinden una atención adecuada, se encuentran muchos mal educados.",,,
Difundir más el programa IMSS Bienestar a la población.,,,
Creación de un Instituto de investigación y creación de medicamentos para las enfermedades que padece la población mexicana.,,,
Atención adecuada y atiendan las urgencias.,,,
Abasto total de medicamentos.,,,
Abasto de medicamentos.,,,
Apoyo a empresas mexicanas para que desarrollen medicamentos y vacunas.,,,
"Pago justo a los médicos y personal, para que ellos puedan hacer su trabajo, ya que varios de ellos en algunos poblados no cuentan con un salario ni con medicamentos.",,,
