La salud mental primordial en una sociedad porque se ve de manera invisible.," Necesitamos que apoyen al presidente y la propuesta es de todos y es una política buena con la educación, los libros son una base para prevalecer como es posible que haya libros tan caros.", Orientar a las personas que desconocen estos temas.,Tener una educación básica desde el kínder para que vean que todos somos iguales y que todos merecemos respeto.
Salud intercultural con acceso universal para todos confrontando un enfoque multidisciplinario que atienda desde la prevención., Que a los niños les den buena educación para que salgan adelante.,Que los adultos mayores tengan atención y cuidados para que los adultos tengan respeto a una vida digna., Solo respeto.
Accesibilidad en la vía pública y en espacios públicos para personas con discapacidades.,Implementar cursos para elegir una carrera universitaria con todas las bases información necesaria., Dar impulso de trabajo desde el hogar para las mujeres amas de casa., Los padres de familia debemos tomar conciencia de educar a nuestros hijos para evitar conflictos en nuestro ámbito social y así convivir sin prejuicios en lo más posible.
Yo solo pido que apoyen a las personas enfermas porque por ejemplo yo soy viuda y estoy enferma y ya no puedo trabajar.,Que los hijos tengan una buena educación., En cuanto a la economía para apoyar a la mujer es seguir brindando el apoyo que tenía el gobierno Alfredo del mazo ya que sí ayudaba.,Orientar dentro de la familia a los hijos e hijas sobre estos temas.
Que todas las clínicas del municipio tengan medicamentos suficiente y atención gratuita., Qué realmente el presupuesto se de a la educación.,"Que se tenga el mismo derecho e igualdad entre hombres y mujeres puesto que la mujer se ha ido abriendo campo en esta sociedad machista. A las mujeres nos llevó mucho tiempo desarrollar una voz, ahora que la tenemos no debemos quedarnos calladas.",Cada quien conoce perfectamente a los familiares más cercanos falta orientar los malos hábitos a actos sanos.
 Capacitación constante a la ciudadanía en relación a la alimentación equilibrada.,Que sea una buena educación para los niños.,"Dignificar el trabajo del hogar. La mujer que trabaja en el hogar y los patrones no pagan con igualdad, menosprecian este trabajo.", No burlarse de las personas diferentes y respetarlas.
"Solicitación de más de una o dos medidas en unidad rural, donde se le solicite un buen trato de solidaridad.",Capacitación tecnológica a estudiantes para desarrollar su capacidad de trabajo., Que se haga valer la equidad y respeto tanto a las mujeres como a los hombres., Están en su derecho de decidir por su vida sin embargo que no se les deje adoptar hijos.
Diálogos para la alimentación.,"Escuelas al 100% porque hay muy malos baños, mejor educación como clases de inglés y computación.",Cómo representante del municipio que sean honestos que apoyen a las amas de casa con algún apoyo económico para poder emprender un negocio para que puedan apoyar a su pareja y poder salir adelante.,"Que no sean provocativos, que se den a respetar, que tengan valores y que den el ejemplo"
Orientación a la alimentación.," Invertir en sector salud, contribuir al desarrollo del país por medio de la educación.",Apoyo económico a las mujeres en especial a las mujeres que no cuentan con ningún tipo de apoyo.,"Que se vistan decentes, que se den a respetar, que se expresen decentemente y que se respeten entre ellos mismos."
" La ciencia nos ha dominado al campo y más que el ser humano ha sido, porque nos pones cualquier cosa bien etiquetada y lo compramos y el campo lo abandonamos el gobierno tiene que seguir apoyando al campo.", Que todos los niños tengan apoyo en las escuelas ya sean rurales o urbanas., Más apoyo a las madres solteras ejecutando leyes para ser más responsable a los padres de los niños., Que nosotros como papás debemos de apoyar en caso de que nuestros hijos tengan diferencias sexuales.
Mayor enfoque en la cultura de prevención y fomento a la lactancia materna.," La educación es la base del progreso, se deben criticar los libros seriamente y se debe apostar por una educación en casa ya que no hay valores.", Igualdad de género y protección a la mujer.," Que se creen áreas destinadas a la atención de este sector desde médicos, psicológicos, trabajo social y oportunidades al par como toda la sociedad."
 Es muy importante que en las instituciones públicas de salud los tiempos para un examen de especialidad se lleven a cabo en tiempo y forma para beneficio del paciente y ya no esperar mucho tiempo., Personalmente me agrada la idea de un examen aplicado para maestros y profesores para evitar corrupción al menos en el aspecto de tener a alguien que no sepa y que sí sepa enseñar., Dar más oportunidades a las mujeres en la política.," El respeto a la diversidad porque así fue su decisión, no señalarlos, no excluirlos de la sociedad."
Que haya más clínicas y más deporte., Es indispensable que cuenten con médicos y medicamento. No es bueno asistir y no tener consultas ni medicamentos.," Brindar atención médica universal para las madres de familia y sus hijos, así como obtención de operaciones y especialidad.",Todos somos seres humanos independientemente de nuestra preferencia sexual.
Que nosotros produzcamos nuestros propios alimentos para que nuestra comida sea una fuente sana., De acuerdo con lo acordado con la Constitución que se hagan los libros como se han venido haciendo para evitar conflictos sociales., Libre acceso a productos de higiene menstrual., Todo mundo tengan los mismos derechos para que no haya exclusiones para nadie.
Que siempre haya medicamento y la atención sea de primera., Profundizar estrategias que permitan desde la militancia fortalecer las puntuaciones políticas., Promover la cultura del cuidado psicológico y emocional., Promover la cultura de la denuncia. Todo acto discriminativo y más por parte de funcionarios y/o servidores públicos no debe ser tomado a la ligera.
Atención médica gratuita para todos.,"La educación de casa, la igualdad, respeto y crear identidad municipal.", Educación sexual para hombres y mujeres en respeto a la salud sexual.,Promover que todos somos iguales.
"En realidad todos los puntos son buenos, yo personalmente señalé la que más repercusión de forma negativa tiene. Un punto que yo daría como extra sería la implementación de escuelas a público general donde se impartan clases de medicina básica para saber qué se puede hacer en ciertos casos donde el llegar a un médico sea difícil.",Que existan lugares donde se pueda aprender la educación básica dentro de San Mateo.,Tener más apoyo y mejor sueldo., Generar opciones para la participación de la política social y pública. Todo sin la necesidad de roles.
Hospitales con médico realmente con ética de trabajo ya que hay muchos hospitales donde los médicos no tienen el compromiso de realmente atender a la gente como debe de ser.,Fomentar la analfabetización dentro de las comunidades de San Mateo capulhuac., Apoyo a la mujer.,Se tiene que respetar e incluir en todos los temas de la ciudadanía y que se ocupen por la transformación.
"Todos las opciones son primordiales desde tener igualdad, cercanía, disponibilidad a un hospital y tener buenos costos al medicamento.",Que tomen medidas para tratar de frenar el bullying.," Equidad en las labores domésticas, cuidando de los hijos y adultos mayores y un apoyo económico para realizar estas actividades en beneficio de las familias ya que los hijos pueden ya entrar casados y con hijos y no tienen tiempo.",Que se hable de la sexualidad y tener valores para aceptar a todos los que son diferentes para también darles prioridad.
Se debe de apoyar el IMSS bienestar., La educación empieza desde la casa y mi propuesta sería darle a los alumnos una educación de calidad y valores que había antes., Legislación más inclusiva para las comunidades., Igual no discriminación hacia las personas que prefieren diferente sexo.
 Todos deben de comer bien y no consumir pura comida mala.,No estoy de acuerdo que en los libros de texto les implementen ideologías de género.,Que todas las mujeres se les trate por igual., Entender que todos somos personas de libre género lo que cuenta es la educación.
Deben de vigilar a las enfermeras y doctores ya que hay mucha negligencia médica ya que tratan a los enfermos muy déspotas.,Que se implemente la lectura en todos los niveles., Que las trabajadoras del hogar puedan tener un seguro.,Respetar la igualdad de género.
Que en los centros de salud que tengan doctores suficientes y también medicamentos suficientes., Que se dé la oportunidad a los jóvenes de que estudien la educación básica abierta.,Que sea equitativo hombre mujer en gasto económico y en el hogar en el cuidado de los hijos.," Que también haya una ley donde defiendan a los hombres para que no sean maltratados, dar más información a los estudiantes sobre la sexualidad para que no haya niños fuera del matrimonio."
 Supervisar al sector salud para que se dé una atención y servicio de calidad a las personas.," Invertir en educación, crear universidades públicas, invertir en servicios de salud, generar propuestas en seguridad.", La igualdad entre el hombre y la mujer debe ser prioridad en todo el país.,"No hipersexualizar a los niños, los juguetes no tienen género. El amor es de todos."
 Garantizar que la atención médica sea de buena calidad y que todos tengan acceso a ella con medicamentos buenos y seguros., Tener una buena educación., Pago igualitario para todas y todos., Los medios de comunicación los principales discriminantes en programas de comediantes sancionar a los personajes cuando toquen temas de discriminación.
 Promover la salud mental en todos los niveles., Que sean gratuitos medicamentos en general. Apoyo de becas.," Que no se politice la imagen de la mujer, actualmente la misma sociedad ya tiene el conocimiento para darle el lugar que la mujer se merece.", Respetar los reglamentos de cada institución y más en las instituciones educativas por la formalidad y valores.
Que se rehabiliten los centros de salud y se equipen los pequeños hospitales.,Que sean gratuitos medicamentos en general. Apoyo de becas., Ampliación de la educación y cultura en escuelas y espacios públicos gratuitos de apoyo para madres e hijos.,Las personas sin discriminación.
Recibir mejor atención médica., Conocer el nivel educativo de la comunidad y darles la oportunidad de crecer laboralmente., Tenemos que apoyar y preparar a la mujer para ser un gran ejemplo., Implementar el respeto pero en especial en los hogares y nosotros como padres de familia aceptar tal cual sean las personas.
 Que tengamos un servicio médico a las 24 horas porque no tenemos ese servicio en algunas fábricas.,"Yo quisiera saber por qué cobran muy altas las inscripciones, por qué no cobran más económicamente para que todos puedan contar con una educación, para los vecinos de bajos recursos, otra propuesta es que no sea obligatoria el cobro de inscripciones porque conozco vecinos que no cuentan con lo económico y las maestras le niegan la educación a sus hijos.", Participación en la creación de una agenda política para las mujeres., Incluir leyes para personas con orientación sexual es separar a la poblacion. La aceptación hacia este tipo de persona se va dando mientras la comunidad aprenda a respetarlas.
Que se cuente con todos los medicamentos para la salud.,Que haya más escuelas.,Que si haya justicia para la mujer separada para el apoyo de la pensión y en cuanto al pago igual., Libertad protegida desde la ley.
" Remover o regularizar las bebidas azucaradas y comida a los niños, tener derecho a la salud mental y nutrición.",La educación en casa tiene que empezar no nada más en las escuelas también en nosotros mismos debemos dar valores.," Que no haya más feminicidios, que haya más seguridad y cámaras.", Igualdad de no discriminación hacia personas que prefieren diferente sexo.
" Un hospital que sea como el López Mateos, que sea general y las carreteras son necesarias para traslados, que no haya baches, un servicio que atiendan las ambulancias y que no atienden cuando se requiere.", Aumentar más becas para los niños de bajos recursos.,Con todo respeto a las mujeres que ejercen un cargo público y no aplican la justicia por ejemplo en una procuraduría no ayudan a la víctima y el agresor quedó impune porque se corrompe la mujer que representa la justicia., En el DIF tener un psicólogo para este tema y orientar a los padres junto con los hijos para su integridad y normal como es todo el mundo.
Algunas clínicas que tengan todos los servicios y que den más fichas para alcanzar consultas.,"La educación se debe hacer universal, ingresar todas las escuelas públicas en la beca Benito Juárez, los directivos se niegan a inscribir la educación para padres.",Apoyar a la mujer así como a los hombres.," No a la discriminación, igualdad para todos."
" Bajar los precios de la verdura para que esté al alcance y se pueda comer sanamente, para de esta manera tener buena salud, construir parques escolares para la juventud.", Considerar el aumento de la calidad educativa en la educación básica. Dar oportunidad a todos., Apoyo económico a la mujer.," No a la discriminación de LGBT. Todos somos iguales, no a la violencia."
Tener una alimentación balanceada y en todos los hospitales de gobiernos sean atendidos paguen o no paguen seguro social.,Bajar los precios básicos.,No cargar mucho el trabajo a las mujeres., Que los padres seamos los que también aceptemos a nuestros hijos tal cual son y que haya pláticas para aceptarnos tal cual somos.
Que tengamos un servicio médico integral.,Que revisen las escuelas y haya más apoyo con los maestros y alumnos.,Que a las mujeres se les vea por igual., Todos somos libres de género y respeto.
 Apoyar las personas de bajos recursos con medicamentos., Promover becas a todos los niveles para evitar deserción escolar y que todos tengan las mismas oportunidades.,Que las mujeres tengan un buen servicio de salud., La sexualidad implica también el trabajo sexual y por lo tanto se debe impulsar políticas públicas para dar protección en salud.
Beneficios para personas con discapacidad., Realizar más encuestas en casa para apoyar realmente a quien lo requiera pero también tomar en cuenta a los niños con buenos promedios sin importar su nivel económico.,Que las mujeres tengan un buen salario y más ayuda económica.,No discriminación y más respeto.
Es importante asegurar que en todas las clínicas tengan abasto de todos los medicamentos para atender a todas las personas que lo necesitan., Aumentar más el cupo de las universidades ya que solo entra una pequeña matrícula.,Educación a hombres con respecto a las mujeres., Tener respeto a las personas diferentes.
" Que tengan atención general y no haya discriminación alguna, que puedan acudir a un llamado de auxilio."," Fortalecimiento educativo, humanístico y solidario.", Que haya mucha seguridad para la mujer y que el trabajo sea hasta los 60 años para las mujeres., Crear contenido de entretenimiento con temas de diversidad sexual.
"Tener acceso a la salud para las personas que no tenemos seguridad social, nutriólogo, psicólogo, cardiólogo y muy importante doctores para la diabetes."," Es necesario impulsar la educación cooperativa ya que los principios cooperativos fomentan la equidad, la solidaridad y el apoyo mutuo, esto contribuirá a formar una sociedad humanista y solidaria.", Que las mujeres sean tratadas con respeto., Respetar la igualdad de género.
"Normalidad más clara, evitar los vacíos legales."," Campaña nacional de fortalecimiento de valores. Campaña de combate a la cultura de la violencia y el delito. Promover en niños, jóvenes el sentido de pertenencia comunitaria.",Más oportunidad para poder trabajar y estudiar y poder ver el hogar., Todas las personas valemos lo mismo y hay que respetar las decisiones de los demás.
" En la comunidad de San Mateo capulhuac no existe algún sistema de entretenimiento para jóvenes, niños y adultos y se debe de hacer ya que están creciendo las adicciones y genera malos hábitos como los robos."," Educación comunitaria, más protección a la legalización de clases de emprendimiento.", Derecho en todos los ámbitos laborales., Todos somos iguales.
 Antes de ingresar a consulta es importante que el paciente sea valorado con trabajo social y psicológico., Más patrullas porque hay muchos rateros., Apoyo económico a las mujeres trabajadoras., Programas en unidad familiar en donde se inculque el amor y cuidado a nuestros hijos.
" La buena alimentación para tener buena salud es un tema que debe fomentarse en la familia. Es importante no consumir embutidos que provocan cáncer, no consumir grandes cantidades de refresco ya que produce diabetes, evitar las grasas para evitar la obesidad.", Que los maestros tengan más conocimiento para enseñar a los niños.,Aumentar el presupuesto.," Fomentar espacios públicos en donde se conviva con la gente haciendo a un lado el origen, la sexualidad, vestimenta y la posición económica."
"Capulhuac no cuenta con programas de prevención, se debe de instalar algún deporte para combatir las adicciones robos estafas y drogadicciones.", Incluir a las becas y clases públicas gratuitas., Igualdad de derechos a las mujeres.,
Buscar otras estrategias que verdaderamente hagan efecto en la salud.,Que los niños tengan más oportunidad de becas porque en Santa Ana Mayorazgo no hay., Que se aumente el presupuesto.,
Que haya igualdad y respeto para combatir la discriminación.,Educación para todos en la lengua que hablemos. Educación al alcance de todos y en todos los lugares.,Que haya igualdad hacia la mujer y que tengan las mismas oportunidades que los hombres.,
" Aumento de impuestos a productos chatarra para atender la salud pública (diabetes, hipertensión). Promover el huerto orgánico de traspatio para alimentación saludable. Cultura y deporte gratuitos para todos.",Que los maestros enseñen más y bien.,Que haya igualdad hacia la mujer y que tengan las mismas oportunidades que los hombres.,
" Control en medicamentos y en la calidad de servicio en el personal médico, que las instituciones estén bien capacitadas en infraestructura, médicos y material.", Instituciones para educar a las personas mayores., Tener justicia para las mujeres.,
" Que tengan atención y medicamentos, un apoyo monetario para los niños con cáncer así como los adultos y estudiantes tienen apoyo a mí me gustaría también las personas con cáncer tuvieran."," Pago digno a los formadores, asegurar su retiro.", Menstruación digna.,
 Que haya más doctores y trabajadores de la salud para que alcancen las fichas.," Fomento a la educación superior, maestrías y doctorados.", Justicia a las mujeres que son violentadas por sus parejas. Oportunidades para la mujer que ha llegado a la tercera edad en lo laboral.,
 Servicio médico para todos., La familia es la primera que debe educar., Que les den más oportunidades a las mujeres y no nada más sean amas de casa.,
" Que haya un hospital donde se atiendan todos los servicios, que se puedan atender todas las emergencias para no tener que trasladarnos tan lejos.",Que realmente hayan visitas a las personas que sí requieren becas porque así es una gran motivación para muchos niños realmente sean muy inteligentes pero muy pobres.,Igualdad.,
Más vacunas en los centros de salud y más servicio médico.,"Erradicar las escuelas privadas, las colegiaturas son excesivas, más escuelas de gobierno. No permitir que les quiten los libros a los niños es su derecho.", Hacer del conocimiento a las personas de las comunidades la existencia del DIF.,
Que tengan lo necesario para tener una buena atención médica.," Mayor cobertura de aceptación a los estudiantes que presentan exámenes a nivel licenciatura, pero también tengan fuente de trabajo en lo que se preparan.", Fortalecer la equidad.,
"Primero lugares para el ejercicio, segundo psicólogo para la depresión, tercero alimentación básica y cuarto que no haya niveles en la salud.",Que el gobierno invierta más en ciencia y tecnología., Apoyos económicos a todas porque la maestra Delfina decían en la campaña que nada más a las que lo necesiten y todas lo necesitamos.,
Considerar también a las personas que padecen una adicción. Fomentar el deporte desde una temprana edad.,Mejoras en educación y apoyar económicamente a los maestros.,Las mujeres somos importantes pero se deben llevar pláticas a la mayoría haciendo conciencia en todos los ámbitos de no ser sumisas pero tampoco sumisar.,
Que haya apoyo para gente discapacitada porque sus familias no tienen los recursos para salir adelante., Hacer universal las becas a todos los estudiantes del país., La participación correcta de las mujeres generando una política de equidad e igualdad entre todos.,
 En la comunidad de San Mateo debe de haber servicios de atención médico y prevención contra las adicciones.,La garantía desde pequeños al derecho a la educación de investigación., Tratar bien a las personas que laboran.,
Tener lo necesario para una atención médica digna., Que la educación tenga alcance a todos los niños y niñas sin condicionamiento.,,
Médico cercanos y al alcance de los medios económicos., Revisar que las becas a los alumnos se utilicen de buena manera.,,
Garantizar el acceso gratuito de medicamentos básicos y necesarios para la comunidad., La escuela debe de ser un segundo hogar donde debe haber instalaciones de calidad.,,
" Programa que incluya atención preventiva desde el preescolar, carnet que contenga atención psicológica, físico y médica."," Priorizar la educación con políticas públicas que garanticen una educación libre, correcta, sin perder el aspecto laico y pedagógico.",,
Más protección civil.,,,
Educación de calidad y programas de salud de calidad.,,,
Que haya medicamentos necesarios.,,,
construir más hospitales donde hagan falta,"crear materias focalizadas a la reflexión a nivel medio superior y superior como filosofía, ética y también inversión como finanzas",que se atienda inmediatamente cuando una mujer sea agredida,valores desde niño se están perdiendo propongo que en las escuelas tengan psicología pero en verdad puedan ayudar para que no haya suicidio en los menores
implementar un sistema de salud eficiente y de amplia cobertura,defender los libros de texto que contengan metodología de educación popular con lenguaje incluyente,"revolución de justicia para las mujeres, profundizar en una reforma legislativa del poder judicial",difundir información acerca de la diversidad sexual para que en la medida de lo posible no haya discriminación y cree conflictos con estos sectores
"diseñar planes de prevención para la salud mental como el suicidio, depresión, etc",apoyar a la nueva escuela mexicana crear discusiones del partido,Apoyo psicológico,dar educación y buena información a toda la ciudadanía de acuerdo a su edad enseñarle sus derechos y obligaciones para el respeto
incluir la atención de salud mental primordial en el país. Costos y apoyo a personas de bajos recursos para servicio médico y medicamentos,eliminar las cuotas de inscripción para garantizar la educación gratuita,"fortalecer el derecho a decidir, procuración de justicia con perspectiva de género, reparación del daño sin revictimización, políticas públicas ampliarlas en favor de la igualdad, paridad, equidad de género",que se les respete a la diversidad sexual
"Que los tiempos de espera sean más cortos, nos tienen demasiadas horas esperando para pasar a tu cita y hace falta medicamentos",creación de lugares comunitarios para poner en práctica lo aprendido en la nueva escuela mexicana,"promover la visibilización de la violencia, garantizar el acceso a espacios públicos de educación feminista y atención a víctimas",el tema debe de tratarse como el germen el origen del patriarcado la religión judeocristiana
que haya más ayuda para las personas de bajos recursos ya que no podemos comprar el medicamento por falta de dinero,que se den becas a los niños para apoyarlos,acceso espacios de toma de decisiones en la vida pública del país,que se enseñe el respeto a los de los distintos géneros de la diversidad sexual para su dignificación
informar a las personas sobre los servicios médicos ya que muchos no conocen cómo se llevan a cabo dichos servicios,"salud psicológica y emocional seguridad y vigilancia en las escuelas, contar con seguros escolares para los alumnos y maestros","talleres, cursos de diversa índole para las mujeres, de sus derechos cómo defenderse y a qué instituciones acudir",no separarlos o etiquetar y crear leyes que protejan a las personas en cuestión de apoyo económico (pensión) sin importar el género
que se garantice la atención médica a personas de bajos recursos y las personas que no cuenten con trabajo tal vez que paguen una cuota simbólica basada en un estudio socioeconómico,educación para toda la ciudadanía,mayores oportunidades laborales a mujeres mayores de 40 años,faltan muchos servicios
"más hospitales cero corrupción en farmacias. Atención integral con espacios públicos fijos; psicología prevención para embarazos, adicciones, arte, capacitación para proyectos productivos, deporte, etc.",potenciar el esquema de infraestructura para que los profesores desarrollen su trabajo al 100%,igualdad sustantiva e integral,educar con respeto
